{
  "schema_version": "obs.probe_plan.v1",
  "probe_plan_id": "PP-latency_timeout",
  "scope": "run",
  "run_id": "R-TEST",
  "goal": "Reduce uncertainty for latency_timeout without making a cause claim.",
  "candidate_probes": [
    {
      "probe_id": "probe.baseline_observe",
      "title": "Run bounded baseline observation",
      "required_capabilities": [],
      "required_privilege": "none",
      "safety_status": "allowed",
      "expected_cost": "low",
      "timeout_ms": 5000,
      "expected_evidence": ["resource.cpu_busy_percent"],
      "discriminates": ["H001"],
      "failure_contract": "return partial context and record unavailable facts in data_quality; do not infer cause",
      "cause_neutral": true
    }
  ],
  "data_quality": {
    "dropped": false,
    "drop_count": 0,
    "throttled": false,
    "missing": [],
    "truncated": false,
    "clock_confidence": "medium",
    "notes": []
  }
}
